url,titulo,texto,status,local,data_hora,problem_type,product_type,category,texto2
https://www.reclameaqui.com.br/electrolux/manchas-roupas_0qPz9WeW2XCE4qNQ/,MANCHAS ROUPAS,"NÃO COMPREM LAVAROUPAS DA ELECTROLUX...
minha mãe adquiriu uma LAVAROUPA ELECTROLUX LED14 14KG CESTO INOX, e desde então ta acontecendo de manchar roupas brancas, camisetas, bermudas, mantinhas, fronhas, e não somente na hora da lavagem, pois coloquei um tênis que lavei a mão para SOMENTE CENTRIFUGAR, e manchou o tênis, ja veio a assistência aqui, ja ligaram da própria electrolux, falaram que é excesso de sabão, ou que a água veio suja e todo aquele bla bla bla, mas não é, minha mae sabe lavar roupas, lavou a vida inteira, sempre tivemos maquinas da brastemp e nunca deu problema, agora essa [Editado pelo Reclame Aqui] aqui alem de manchar roupas, demora uma eternidade para lavar, ela está na garantia ainda, e pessoal da electrolux não quer devolver o dinheiro, já fomos no procon e nada foi feito, queremos nosso dinheiro de volta, pois com essa maquina não tem condições de ficar. no mínimo essas máquinas são velhas e eles trocam algumas peças e colocam pra venda novamente..",,Chapecó - SC,25/07/2024 às 13:34,Eletrodomésticos,Lavadora de roupas e Tanquinho,Má qualidade,--
https://www.reclameaqui.com.br/electrolux/assadeira-que-gruda_AuKuWZSxvmqLR7AT/,Assadeira que gruda,"Bom dia, comprei uma Air Fryer muito boa por sinal, porém ela gruda, gruda tudo, batata, frango, pão, carne vermelha... fiz o processo como recomendado porém não tem nada que não grude na assadeira, a mesma não tem dois meses de compra, não foi usada tantas vezes. Porém não ter o que fazer pois até descascar a mesma já descascou. Vou enviar as Fotos em anexo.",,Cajamar - SP,28/07/2024 às 10:56,Não encontrei meu problema,--,Produto com defeito,--
https://www.reclameaqui.com.br/electrolux/trocaram-peca_Uo96E2s30uxa3OyM/,Trocaram peça,"Então já tem uns tempos que estou nessa labuta com a empresa citada , vieram trocaram as peças pela msm , falei com o técnico pra trocar por outro material ele me falou que testou que ligou as bocas e se fosse pra ficar igual já teria ficado, pois bem foi embora , quando terminei a janta a as grades já estavam brancas , e o pior as grandes ficam balançando ficou pior do que a q veio, q a outra n balançava e agora tá complicado , e melhor me devolver o dinheiro vou comprar outra marca pq tá complicado a eletrolux, fora q os técnicos querem ir na sua casa na hora q eles querem se o atendimento é das 13.00 as 18.00 nunca podem ir as 16.00 sabe , alegam q e a rota do técnico complicadissimo",,São Paulo - SP,30/07/2024 às 08:12,Eletrodomésticos,Fogão-Forno,Má qualidade,--
https://www.reclameaqui.com.br/electrolux/defeito_v14O18oqFIWKKv3E/,Defeito,Comprei uma Air fryer da electrolux no dia 05/04/2024 e a mesma depois de alguns uso começou a estoura a aderência e descascar gostaria de saber como procede para a troca.,,Maceió - AL,30/07/2024 às 08:10,Não encontrei meu problema,Fritadeira elétrica,Má qualidade,--
https://www.reclameaqui.com.br/electrolux/minha-lava-loucas-electrolux-de-14-servicos-com-pouco-mais-de-um-ano-de-us_n11uMeXs1iTeeUQU/,"Minha lava louças Electrolux de 14 serviços, com pouco mais de um ano de uso parou de funcionar.","A reclamação é o seguinte, comprei a lava louças LL 14 x Electrolux de 14 serviços dia 12 de abril de 2023 no próprio site Electrolux, sendo que todos meus eletrodomésticos são da mesma marca, quando foi pouco mais de um ano de uso no dia 31 de maio de 2024 ela parou de funcionar, contactei a assistência técnica de Uberaba que é a cidade mais próxima da minha (Sacramento Mg) onde tem Assistência Técnica chamada: Refrimaq, telefone:******* Endereço: Rua Gabriel Junqueira N: 181 B: Boa Vista, Uberaba MG. Entrei em contato com eles começo do mês de junho, informaram que eu teria que pagar uma taxa de 100,00 para o técnico deslocar de Uberaba e vir fazer a avaliação do problema, assim fiz eles marcaram e vieram fazer a avaliação, paguei os 100,00 , viram que o problema era a válvula na voltagem 220v, que tinha queimado, a secretária disse que por volta de 15 dias a peça chegaria, e hoje já são 30 de julho e até hoje não me deram um parecer dessa peça, dia 15 de julho enviei uma mensagem via whatsapp perguntando se a peça já teria chegado e ficaram de verificar e nada, quando foi dia 17 de julho enviei outra mensagem via whatsapp perguntando novamente e a pessoa me respondeu que iria verificar e não me deu resposta até agora dia 30 de julho, estou indignada com tanta falta de profissionalismo e atenção, estou a 2 meses com a minha máquina sem funcionar, um produto caro que só funcionou pouco mais de um ano, passou um ano ela vai e estraga, já não entra mais na garantia, pago a avaliação do problema e tenho que pagar mais 350,00 do conserto dessa válvula e até hoje nenhum parecer, se soubesse que seria assim não teria comprado nenhum eletrodoméstico dessa marca, porq comprei também o refrigerador Electrolux 590l inox de 3 portas, o material do inox é sem qualidade só de fechar as portas já tem amassados visíveis nas porta, deveria ter comprado Brastemp que tem melhor qualidade nítida. Aguardo um retorno urgente sobre minha lava louças, porque entrar em contato com a Refrimaq já não tenho esperança de um retorno.",,Sacramento - MG,30/07/2024 às 08:01,--,--,--,--
https://www.reclameaqui.com.br/electrolux/manutencao-ar-condicionado_DjQ8-BvMqteprYdJ/,Manutenção Ar condicionado,"Comprei um ar condicionado Color adapt atraves das casas Bahia ( mais ou menos 4 meses atras ) fiz a instalção de acordo com o exigido pela fabrica , o ar funcionou cerca de 3 meses ( se muito )

Após isso o ar condicionado nao esquenta e nao esfria, sofri um bom tempo ate conseguir abrir um chamado.

uma empresa da minha cidade me procurou em nome da eletroluz ( ALGO A MAIS ) e falou que estaria cuidando do caso.

ja de antemão avisei que seria necessario rapel para acessar a condensadora , a mesma avisou que não efetuava. eu disse que entao ja verificasse com a fabrica o procedimento. o mesmo me relatou que iria destinar um tecnico da mesma forma. aguarde mais 15 dias!!!

no dia da visita o tecnico chegou e confirmou que o problema ERA GARANTIA e o acesso era na condensadora, ou seja, perdi tempo

2 dias depois a empresa me informou que o rapel seria por minha conta..

isso nao existe!!!! preciso imediatamente de um retorno da fabrica!

o ar nao rodou nem 3 meses, é um absurdo, que confiança tenho no equipamento para repor ele no local ?",,Caxias do Sul - RS,30/07/2024 às 07:52,Eletrodomésticos,Ar condicionado,Assistência técnica,--
https://www.reclameaqui.com.br/electrolux/descaso-com-o-cliente_bpg04efJWeySX8jk/,Descaso com o cliente,"Adquiri um fogão diretamente no site da Electrolux porque tinha como um dos benefícios a primeira conversão para GN gratuita.
Como só posso atender a assistência técnica na parte da manhã, antes de efetuar a compra liguei para o número indicado péla Electrolux e perguntei se atendiam nesse horário, com a resposta positiva finalizei a compra.
O fogão chegou em 17/07, antes do prazo, e a experiência que tinha tudo para ser incrível se tornou um pesadelo, pois a assistência técnica de abrangência da minha residência se nega atender nesse horário. Fez dois agendamentos para parte da manhã e no dia fui informada que seria na parte da tarde.
Entrei em contato com a Electrolux nos dias 19/07 e 24/07 para resolver o problema mas até o momento não tive nenhuma solução. Nas ligações me deram o prazo máximo de dois dias úteis para retorno de cada ligação e não obtive nenhum tipo de retorno. Em 27/07 liguei novamente e o setor que está tratando do caso não funciona, então a atendente disse que deveriam me retornar em 29/07, o que não ocorreu.
Ou seja, estou totalmente insatisfeita com o comportamento da Electrolux na tratativa do meu problema.
Que pelo menos me digam se irão ou não realizar a conversão na parte da manhã como estou solicitando, pois não quero ficar sendo prejudicada por essa situação.",,Rio de Janeiro - RJ,30/07/2024 às 05:47,Eletrodomésticos,Fogão-Forno,Assistência técnica,--
https://www.reclameaqui.com.br/electrolux/impossibilidade-de-comprar-lava-loucas_xZjVUvFuvM1bdUSC/,Impossibilidade de comprar lava louças,"Estou a 3 semanas tentando comprar a ""Lava-Louças Electrolux 8 Serviços Inox com Função Higienizar (LL08S) - 220V"", e apesar de ter em estoque no site, ao colocar meu CEP, de São Paulo-SP, recebo o aviso ""Não há disponibilidade de envio ou retirada em loja para o CEP informado"". A electrolux me envia, por e-mail, cupons de desconto e promoções todos os dias para que compre a lava louça, e eu quero comprar, porem não disponibilizam estoque real nunca, gerando frustação e transtorno imenso.",,São Paulo - SP,30/07/2024 às 09:03,--,--,--,--
https://www.reclameaqui.com.br/electrolux/ar-condicionado-apos-conserto-apresenta-o-problema-maior_J_jU6zkKja5U7JUO/,ar condicionado apos conserto apresenta o problema maior,"Electrolux manda o tecnico, 2x primeiro troca de 3 pecas, detalhe ar novo!
Apos, o aparelho esta com um barulho elem do que eu vi na loja pois era mais silencioso. minha cunhada que não escuta (usa aparelho implante coclear) onde a audicao nao e nitida. Fui na residencia dormir pra ve se o aparelho estava bom, depois de 3 vezes a ssistencia tecnica ir arrumar!
Aparelho novo! Ao dormir percebo que foi arrumado! O aparelho faz barulho alto, como dormir?
Padrão de qualidade fora da normalidade da ELECTROLUX!!
Liguei novamente para a assistencia tecnica e a mesma me disse que so iria sob o pagamento da visita???? garantia! até quando vai ser arrumado. ????
E que eu entrasse em contato com a fabrica!!
Acho que ja esta havendo desgaste demais, aguardo mais uma vezs a posição da fabrica, quero o meu aparelho conforme o especificado nas propagandas, ou as propagandas não colocam os problemas???!!
Bem chateada com isso, quero qualidade e respeito, porque ja deu né!",,São Paulo - SP,29/07/2024 às 23:09,Eletrodomésticos,Ar condicionado,Produto com defeito,--
https://www.reclameaqui.com.br/electrolux/gaxeta-com-problema-cronico_ISbOKZNMrpQchuZg/,gaxeta com problema crônico,"Tenho uma geladeira dbx53. A borracha com 3 anos de uso rasgou. Como estava fora da garantia foi preciso pagar uma visita e o técnico da Electrolux informou ser mal uso, como abrir a porta sem usar o puxador. Discordei pois sempre usamos o puxador, de qualquer forma efetuamos a troca da borracha.

Agora, 11 meses depois da troca, a borracha novamente esta rasgada. As vezes a borracha solta também, tanto na primeira quanto na segunda borracha.

Enfim, estou com uma geladeira com menos de 5 anos de uso, e penso que a vida útil de uma geladeira Electrolux desse valor deveria ser maior.

Entendo que o produto esta fora da garantia, mas quando peço solução para Electrolux é sempre preciso pagar técnico para visita que inviabiliza qualquer tipo de tratativa com a empresa e ainda dizem a mesma coisa, mal uso, etc..",,Concórdia - SC,29/07/2024 às 22:45,Eletrodomésticos,Geladeira-Refrigerador,Assistência técnica,--
https://www.reclameaqui.com.br/electrolux/fritadeira-com-erro-1_6Nwy1bUmJDbWSjBD/,Fritadeira com erro 1,"Efetuei uma compra de uma fritadeira Electrolux Rita Lobo no site do Carrefour e após duas vezes de uso ela apareceu uma mensagem de erro 1 e não funciona por nada, já tentei contato mais não obtive resposta, fiquei super chateada por todos meus meus eletrodomésticos da marca Electrolux e nunca tive problema algum. Aguardo um retorno.",,Betim - MG,29/07/2024 às 22:37,Eletroportáteis,Fritadeira elétrica,Produto com defeito,--
https://www.reclameaqui.com.br/electrolux/problema-com-maquina-de-lavar-lfe11_9puxKhwEe1-y7Zz2/,Problema com máquina de lavar LFE11,"Boa tarde, gostaria de fazer uma reclamação com relação ao atendimento do sac, fiz uma solicitação de devolução a semana passada de uma lavadora lfe11 que veio com defeito comprei dia 08/06/24 e está cada vez mais pior de usar, liguei duas vezes e não tive retorno algum, sexta-feira a solicitação 18136442 foi feita novamente e nada ainda o rapaz disse que iam me ligar, nada até agora.
A assistência já fez um reparo e não deu certo, as peças demoraram para chegar, não da pra continuar assim, não tem como ficar esperando esse tempo todo, agora entro no site da Electrolux e aparece que meu produto está fora da garantia, SACANAGEM ISSO. Eu quero que troquem essa maquina problematica ou devolvam meu dinheiro.
Se eu nao tiver retorno irei na justiça essa semana, não vou adiar mais nada, o tempo está passando e nao tenho resposta, é inadmissível uma maquina com pouca semana de uso esta desse jeito e cada vez mais pior, impossível lavar roupa. Estou filmando tudo e vou levar para as autoridades.",,Campo Grande - MS,29/07/2024 às 22:28,Eletrodomésticos,Lavadora de roupas e Tanquinho,Produto com defeito,--
https://www.reclameaqui.com.br/electrolux/geladeira-french-door_w_WvqY-bB4z7-LMy/,Geladeira french door,"Comprei uma geladeira da Electrolux frenchdoor ha 4 anos atrás, parou de gelar e não tem mais conserto, uma geladeira que está em torno de 6 mil, não tem conserto !!!
Ela parou de funcionar, e p/ nossa surpresa após o técnico da Electrolux investigar disse q a geladeira não tem mais conserto pois vazou gás no gabinete, e qdo isso acontece não tem o q fazer, gastar uma fortuna na geladeira e parar de funcionar em 4 anos é um absurdo, pois bem entramos em contato com a Electrolux explicamos o q ocorreu e a empresa nos fez uma proposta de pegar outra geladeira com desconto, e que iria gerar um boleto em até 10 dias uteis e após pagarmos o boleto teriam mais 10 dias úteis p entregar a nova geladeira, aceitamos a proposta!
Ocorre que hoje fazem 13 dias úteis e não enviaram o boleto, não respondem e-mail, não retornam ligação, ou seja não dão retorno nenhum e não cumprem com o combinado !! Um absurdo !! Estou sem geladeira há meses e essa situação não é resolvida !",,São Paulo - SP,29/07/2024 às 22:01,Eletrodomésticos,Geladeira-Refrigerador,Produto quebrou com pouco tempo de uso,--
https://www.reclameaqui.com.br/electrolux/cafeteira-eletrica-ecm30-electrolux_HseBcyRcuB0l4OMH/,Cafeteira elétrica ecm30 Electrolux,"Minha cafeteira eletrolux ecm30 quebrou o corta pingo (suporte do filtro permanente) por cair no chão, até aí tudo bem, pois eu não acho essa peça pra comprar em site nenhum, ja rodei na cidade toda e nada, engraçado que os outros modelos vc acha em tudo que lugar, mais o da cafeiteira eletrolux ecm30 não tem peça de reposição em lugar nenhum. Tentei ver no próprio site da Eletrolux mais também não achei. Parece que não fazem peças de reposição.. um simples suporte do filtro! Se eu soubesse disso não teria comprado essa marca, pois parece ser a única não ter peça de reposição..",,Campo Grande - MS,29/07/2024 às 21:59,--,--,--,--
https://www.reclameaqui.com.br/electrolux/pontos-elux_PVU9m2h8MtYsnZav/,Pontos elux,"Participo da campanha da corrida dos campeões electorlux a mesma premia funcionários que vendem os produtos , e não está pagando quero meu dinheiro do incentivo.",,Natal - RN,29/07/2024 às 21:33,--,--,--,--
https://www.reclameaqui.com.br/electrolux/problema-com-maquina-de-lavar-soltando-o-cara-fiapos-e-fazendo-barulho-dura_dKeduatBbSKfBOFC/,Problema com máquina de lavar soltando o cara fiapos e fazendo barulho durante a centrifugação,"Prezada equipe

Gostaria de relatar um problema que estou enfrentando com a minha máquina de lavar, modelo led14

Recentemente, tenho percebido que durante a centrifugação, a máquina está soltando o cata fiapos do meio do tambor, os quais batem na tampa e causam um barulho bastante incômodo. Além disso, essa situação tem causado preocupação em relação ao possível desgaste da máquina.
Além disso, realizei uma limpeza completa do filtro, seguindo as instruções do manual do usuário.
Estou preocupado com o possível desgaste prematuro da máquina e gostaria de resolver essa questão o mais rápido possível. Máquina com 1 ano de comprada. Super nova

Agradeço antecipadamente pela atenção e aguardo uma resposta para agendarmos uma visita técnica.

Atenciosamente,",,Linhares - ES,29/07/2024 às 21:22,Eletrodomésticos,Lavadora de roupas e Tanquinho,Fazendo muito barulho,--
https://www.reclameaqui.com.br/electrolux/purificador-electrolux_Vtq6TPxVekPU9pjG/,PURIFICADOR ELECTROLUX,"Comprei um purificador electrolux pure 4x, e o mesmo apresentou avarias no nome sobre o touch onde está escrito natural, fria e gelado.
As escritas estão apagando e o produto não tem nem 3 meses de uso.",,São Paulo - SP,29/07/2024 às 21:10,Não encontrei meu problema,Purificador,Má qualidade,--
https://www.reclameaqui.com.br/electrolux/problema-grave-de-seguranca-com-aspirador-electrolux-ergo-rapido-risco-de_YBpxtjm6uM3VJ4Al/,Problema Grave de Segurança com Aspirador Electrolux Ergo Rápido - Risco de Incêndio!,"No dia 17/05/2021, comprei um aspirador de pó Electrolux Ergo Rápido através do Mercado Livre (pedido #*******). Recentemente, o aparelho apresentou um problema gravíssimo de segurança: um curto-circuito que quase causou um incêndio em nosso apartamento enquanto o aparelho estava sendo alimentado continuamente na tomada.

Contatei a Electrolux e fui orientada a abrir uma nota de serviço em uma loja autorizada. No entanto, recebi uma ligação dessa empresa informando que a tomada do aspirador havia sido violada, o que, segundo a empresa, os exime de responsabilidade. É verdade que meu pai tentou consertar o aparelho por conta própria, mesmo eu tendo advertido contra isso.

Apesar dessa tentativa de reparo caseiro, a engenharia da Electrolux afirmou não encontrar justificativa plausível para o curto-circuito, mas se dispôs a reparar o aparelho. Contudo, se não há justificativa plausível para o problema, o que exatamente será reparado? Esse tipo de resposta é evasiva e não aborda a gravidade do incidente.
Solicito formalmente que a Electrolux faça uma análise detalhada do aparelho, considerando a gravidade do incidente e a potencial falha de fabricação que possa existir. Não se trata apenas de um reparo, mas de uma investigação que garanta que outros consumidores não estejam em risco.

O aparelho ERG 25 esteve alimentado na mesma tomada durante três anos e quase incendiou o apartamento. A resposta evasiva da Electrolux, afirmando que o curto-circuito nada tem a ver com o aparelho, é inaceitável para um problema tão sério. Tenho o direito de receber um produto que esteja em conformidade com as normas de segurança e qualidade.

De acordo com os ditames do CDC que primam pela segurança e qualidade dos produtos, considero justa não só uma investigação detalhada de um possível erro de fabricação, mas também do ressarcimento do valor investido no aparelho.",,Rio de Janeiro - RJ,29/07/2024 às 20:40,Eletroportáteis,Aspiradores e vassouras,Má qualidade,--
https://www.reclameaqui.com.br/electrolux/39-dias-aguardando-troca-do-produtos-marca-nao-cumpri-os-prazos-com-client_2POW99FV5vqnPxbI/,"39 dias aguardando troca do produtos, marca não cumpri os prazos com cliente!","Todos meus eletrodoméstico são electrolux, se vou comprar pr minha mãe compro electrolux, sempre gostei da marca! Pois bem comprei meu tão sonhado cooktop de indução electrolux, paguei mais caro em uma loja pois não podia aguarda o prazo da corrente tinha urgência, produto chegou e foi instalado como manda o manual rigosamente , disjuntor e fio na expessura... Com menos de dois meses de uso o produto parou de funcionar,abrir o chamado dia 20/06 o tecno veio no dia seguinte constatou defeito e fez pedido da peça pr reparo,o prazo era 15 dias úteis para peça chegar, passou o prazo e nada da marca entrar em contato para dar uma satisfação, alguns dias depois fui informada que a peça estava em falta e não chegaria, como já estava perto de completar 30 dias é de direito do consumidor um produto novo e foi isso que me passaram que até dia 29/07 o coocktop chegaria na assistência técnica para a assistência técnica me passar um novo prazo para a troca. Hoje é o 39 dia que estou sem cozinhar, comprando almoça e janta, aguardando todos os prazos que não foram cumpridos estou extremamente idgnada com o descaso com o cliente, estamos falando de um produto de extrema importância!

Por lei tenho o direito do ressarcimento do valor pago imediatamente,
em relação à substituição de produtos com defeito é o Código de Defesa do Consumidor (CDC). O artigo 18 do CDC estabelece que, se o produto apresentar um defeito e não for consertado no prazo máximo de 30 dias, o consumidor tem direito à substituição do produto por outro igual, à restituição imediata da quantia paga ou ao abatimento proporcional do preço.Aqui está o trecho relevante do CDC:Art. 18. Os fornecedores de produtos de consumo duráveis ou não duráveis respondem solidariamente pelos vícios de qualidade ou quantidade que os tornem impróprios ou inadequados ao consumo a que se destinam ou lhes diminuam o valor, assim como por aqueles decorrentes da disparidade, com a indicação constante do recipiente, da embalagem, rotulagem ou mensagem publicitária, respeitadas as variações decorrentes de sua natureza, podendo o consumidor exigir a substituição das partes viciadas. 1 Não sendo o vício sanado no prazo máximo de trinta dias, pode o consumidor exigir, alternativamente e à sua escolha: I - a substituição do produto por outro da mesma espécie, em perfeitas condições de uso; II - a restituição imediata da quantia paga, monetariamente atualizada, sem prejuízo de eventuais perdas e danos; III - o abatimento proporcional do preço.",,Suzano - SP,29/07/2024 às 20:19,Não encontrei meu problema,Cooktop,Produto quebrou com pouco tempo de uso,--
https://www.reclameaqui.com.br/electrolux/chaleira-eletr-efficient-eek10-nao-comprem_zeyYaseW-gn03ueA/,Chaleira Eletr Efficient Eek10 não comprem!,"No dia 02/01/24 eu comprei a Chaleira Eletr Efficient Eek10 e menos de 2 meses a molinha que permite a abertura e fechamento da tampa, apenas acionando botão, caiu. Mesmo assim continuei usando a chaleira, afinal ela foi não foi mto barata. Agora, no final de julho, a chaleira qdo liga na tomada já começa a ferver a água (mesmo sem acionar o botão de liga/desliga). Daí quando a água começa a ferver o botão não desarma, ou seja, a chaleira não desliga. Pra que isso aconteça, é necessário desligar o plug da tomada. E qdo a chaleira começa a resfriar o botão liga/desliga volta a posição desligado. Enfim, não comprem esta chaleira. Não vale o investimento! Além de não apresentar segurança nenhuma. Sabe aquela chaleira mais barata, que custa em torno de R$100, de qualquer outra marca nacional? Compre essa! Tive uma que durou quase 1 ano sendo usada todo os dias. Mas resolvi investir em uma de ""qualidade e renome"" e me lasquei.",,Porto Alegre - RS,29/07/2024 às 20:16,Eletroportáteis,Cafeteiras e Chaleiras,Produto com defeito,--
https://www.reclameaqui.com.br/electrolux/geladeira-enferrujou-teto_w03WjcrjsKzNNq2E/,Geladeira enferrujou teto,Fomos limpar a geladeira e nos deparamos com o teto dela toda enferrujado..,,Itapema - SC,29/07/2024 às 19:30,Eletrodomésticos,Geladeira-Refrigerador,Má qualidade,--
https://www.reclameaqui.com.br/electrolux/comprei-um-carro-no-freita-leilao-e-na-hora-que-foi-fazer-a-transferencia_WWigA709bPAAjgNF/,"Comprei um carro no freita leilão, e na hora que foi fazer a transferência, costa que foi bloqueado e até agora nada foi feito.","Comprei um carro no freita leilão, e na hora que foi fazer a transferência, costa que foi bloqueado e até agora nada foi feito.",,Mogi-Guaçu - SP,29/07/2024 às 19:20,--,--,--,--
https://www.reclameaqui.com.br/electrolux/pedido-consta-como-entregue-mas-nao-recebi_DykUj59K1mcjqVJn/,"Pedido consta como entregue, mas não recebi","Hoje, 29/07 chegaram notificações no WhatsApp e no meu e-mail informando que meu pedido havia sido entregue. Verifiquei no site da Electrolux e também consta como entregue às 18h03. Porém não recebi nada. Verifiquei com meus vizinhos e nenhum deles recebeu também.

Número do pedido: #v50410727elux-01",,Cornélio Procópio - PR,30/07/2024 às 09:13,Eletroportáteis,Purificador,Atraso na entrega,--
https://www.reclameaqui.com.br/electrolux/defeito-geladeira-side-by-side-em-2-anos-de-uso_3RUv-98d_izg0Wyr/,Defeito Geladeira side by side em 2 anos de uso,"Comprei uma geladeira side by side electrolux ss72x em exatos 2 anos a geladeira parou de gelar, chamei a assistência e informaram que vazou o gás pelo gabinete e que é um defeito comum nesse modelo, porém a geladeira custa 10k reais e dura apenas 2 anos, um absurdo. O técnico ainda informou que não tem conserto e que o recomendável é descartar e comprar outra geladeira, um absurdo. Produto sem qualidade, vou acionar judicialmente pois é um claro defeito de fábrica.

Anexa nota fiscal",,São Paulo - SP,29/07/2024 às 18:20,Eletrodomésticos,Geladeira-Refrigerador,Produto com defeito,--
